{
  "specVersion": "1.0.1",
  "source": {
    "provider": "azure",
    "subscriptionId": "sub-001",
    "region": "westeurope"
  },
  "target": {
    "provider": "aws",
    "accountId": "123456789012",
    "region": "eu-west-1"
  },
  "resources": [
    {
      "id": "func-002",
      "serviceArea": "Functions",
      "sourceType": "Microsoft.Web/sites",
      "targetType": "AWS::Lambda::Function",
      "name": "public-func",
      "decision": "high-risk",
      "properties": {
        "runtime": "python3.12",
        "triggers": ["http"],
        "authLevel": "anonymous"
      },
      "notes": "Public endpoint requires manual review"
    },
    {
      "id": "vnet-002",
      "serviceArea": "VNet",
      "sourceType": "Microsoft.Network/virtualNetworks",
      "targetType": "AWS::EC2::VPC",
      "name": "shared-vnet",
      "decision": "needs-review",
      "properties": {
        "cidr": "10.20.0.0/16",
        "subnets": 4,
        "publicSubnets": 2
      }
    }
  ],
  "dependencies": [],
  "risk": {
    "overallScore": 78,
    "classification": "high-risk",
    "dimensions": {
      "identityExposure": 65,
      "networkExposure": 85,
      "unsupportedMappingRisk": 70,
      "blastRadius": 80
    }
  },
  "validationHints": [
    "require explicit approval",
    "restrict API Gateway auth"
  ],
  "traceability": {
    "sourceCommit": "e129d4f",
    "generatedAt": "2026-09-24T09:22:00Z",
    "generatedBy": "mapping-agent"
  }
}
