{
  "specVersion": "1.0.0",
  "source": {
    "provider": "azure",
    "subscriptionId": "sub-001",
    "region": "eastus"
  },
  "target": {
    "provider": "aws",
    "accountId": "123456789012",
    "region": "us-east-1"
  },
  "resources": [
    {
      "id": "kv-001",
      "serviceArea": "KeyVault",
      "sourceType": "Microsoft.KeyVault/vaults",
      "targetType": "AWS::SecretsManager::Secret",
      "name": "app-kv-prod",
      "decision": "auto-migratable",
      "properties": {
        "softDeleteDays": 90,
        "purgeProtection": true
      },
      "notes": "No public endpoint"
    },
    {
      "id": "func-001",
      "serviceArea": "Functions",
      "sourceType": "Microsoft.Web/sites",
      "targetType": "AWS::Lambda::Function",
      "name": "orders-func",
      "decision": "auto-migratable",
      "properties": {
        "runtime": "python3.12",
        "triggers": ["http"]
      }
    },
    {
      "id": "vnet-001",
      "serviceArea": "VNet",
      "sourceType": "Microsoft.Network/virtualNetworks",
      "targetType": "AWS::EC2::VPC",
      "name": "core-network",
      "decision": "auto-migratable",
      "properties": {
        "cidr": "10.10.0.0/16",
        "subnets": 3
      }
    }
  ],
  "dependencies": [
    {
      "from": "func-001",
      "to": "kv-001",
      "kind": "reads-secrets"
    }
  ],
  "risk": {
    "overallScore": 23,
    "classification": "auto-migratable",
    "dimensions": {
      "identityExposure": 20,
      "networkExposure": 30,
      "unsupportedMappingRisk": 25,
      "blastRadius": 15
    }
  },
  "validationHints": [
    "verify lambda can fetch secret",
    "run cfn-lint",
    "run checkov"
  ],
  "traceability": {
    "sourceCommit": "9a12bc3",
    "generatedAt": "2026-09-24T09:20:00Z",
    "generatedBy": "mapping-agent"
  }
}
